{
  "schema_version": 1,
  "captured_at": "2026-07-08T00:00:00Z",
  "repository": {
    "full_name": "rezahh107/elementor-v4-knowledge-base",
    "default_branch": "main",
    "main_sha": "aaaaaaaaaaaaaaaaaaaaaaaaaaaaaaaaaaaaaaaa"
  },
  "pull_requests": [
    {
      "number": 72,
      "state": "open",
      "draft": false,
      "merged": false,
      "mergeable": true,
      "head_sha": "5555555555555555555555555555555555555555",
      "head_ref": "migration/KB-008-active",
      "base_ref": "main",
      "stage_id": "KB-008",
      "labels": ["automation"],
      "updated_at": "2026-07-07T10:00:00Z",
      "reviews": [],
      "review_threads": [],
      "workflow_runs": [
        {
          "id": 102,
          "name": "KB Quality",
          "event": "pull_request",
          "status": "completed",
          "conclusion": "success",
          "head_sha": "5555555555555555555555555555555555555555",
          "run_attempt": 1,
          "created_at": "2026-07-07T12:05:00Z",
          "updated_at": "2026-07-07T12:10:00Z"
        }
      ]
    }
  ],
  "workflow_runs": []
}
